name,urn,country,products,brandname
"Dongguan Kovan Electronics & Technology Co., Ltd.",1X084PR6,Mainland China,Car Video System;Car Multimedia System;Car GPS System;Car Audio System,
"Dongguan LNSU Electronic and Technology Co., Ltd.",1X07Y9MN,Mainland China,HD Car DVR;Smart Android TV Box;Anti-Radar Detector;Android GPS Navigator;Laser Signal Detector;Car Bluetooth Speaker,
"Dongguan Wiiki-Tech Electronic Co., Ltd.",1X0A7E0U,Mainland China,CRS Bluetooth Car Kit ;Bluetooth Device;Car Bluetooth Speaker,
ESV Inc.,1X09GIQS,"Korea, Republic Of",AVMR;DashCam;Drone;Quad-drome,
EZNEX,1X049E2S,"Korea, Republic Of",Solar Powered Bluetooth Handsfree Kit;FM Transmitter,
Easo Stereo Co. Ltd.,1X00IIYK,Taiwan,Car Amplifier ;Car Amplifier;Car Equalizer Amplifier;Stereo Car Amplifier;Equalizer Amplifier;Car Active Subwoofer;Car Power Amplifier;Car Audio Processor Amplifier,
East Audio Technology Co. Limited,1X0AES9F,Hong Kong,LCD Deckless MP3 with 2 USB Ports;LCD Deckless MP3 with Colorful Display,
Eastern Master Trading Co Ltd,1X04UVXI,Taiwan,Car Subwoofers;Car Amplifier,
"Elite Audio Co., Ltd.",1X00IJ87,Taiwan,TFT LCD Monitor;Vacuum Tube Amplifier;Vacuum Tube Power Amplifier;Cable;Car Component Speaker;LCD Monitor,
Emmie Trading Limited,1X0AQ04W,Hong Kong,Car DAB Digital Radio,
Enjoy Group (HK) Co Ltd,1X076CV5,Hong Kong,Coronavirus Testing;Car Headrest Entertainment System;Cassette Radio;Thermometer;USB Cassette Capturing Device;Disposable Face Mask;Glove;KN95 Mask,
Exploter International Electronics Limited,1X0AC30R,Hong Kong,Car DVD,
"FMS Co., Ltd.",1X05X1GH,"Korea, Republic Of",DVD Player-Navigation Device for Cars;2-Din Universal AVN System;Car AV System;Car AVN System;Car Entertainment System;Android Navigation System,
Fengshun Peiying Electro-Acoustic Co Ltd,1X03SFCF,Mainland China,CAR SPEAKER;Car Amplifier;Car Speaker;Bluetooth Speaker;Android Double Din;Subwoofer;SUBWOOFER;CAR AMPLIFIER,ELEMENT-5;ELEMENT-5;ELEMENT-5
Forall Group Limited,1X049E1T,Hong Kong,Car Multimedia Player,
Forest Technology Co,1X0058WG,Hong Kong,"2.0 Multimedia Speakers;12"" Subwoofer;Subwoofer;Stereo Speakers;Surround Woofer;Coaxial Speaker",WOOG;WOOG;WOOG
"Freecool Science & Technology Co., Ltd.",1X0987D2,Taiwan,Cooler Bag with Radio;Car Refrigerator,
"Fujian Huamin IMP & EXP Co., Ltd",1X00JQ5P,Mainland China,Parka Vest & Body Warmer;Fishing Wear;Safety Parka and Vest;Safety Parka Jacket;Global Positioning System Navigator;Soft-Shell Jacket;Heatpads;Safety Vests/ Waistcoat;Outdoor Parka;Car DVD Player,
Fujian Kirisun Electronics Co Ltd,1X07PJSN,Mainland China,Vehicle Two Way Radio,kirisun;kirisun;kirisun
GUANGZHOU CHE ZHI LIAN ELECTRONICS CO LTD,1X0AGDZY,Mainland China,3D Rotation Tweeter;Car Fiber Optical Most Amplifier;Diamond Tweeter,
GUANGZHOU XINGKAIYUE IND'L CO LTD,1X08Y2CI,Mainland China,LCD Headrest Monitor;Android Car Headrest Monitor;Headrest Monitor;Car Rear Seat Monitor;Car Headrest Monitor;Headrest Seat Back Monitor;Car Monitor;Car LCD Monitor;Car Multimedia Entertainment System;Portable Car Rear Seat Monitor,
Gh Development Holdings Limited,1X09E909,Hong Kong,Car Audio Video Nevigation,
"Gioclavis Co., Ltd.",1X0995D8,"Korea, Republic Of",GIO Smart Pillow;Pillow;Gio Smart Pillow,
Glosys Inc.,1X04P8QM,"Korea, Republic Of",2-DIN DVD Player;Car Multimedia Player;Car Entertainment System;Car Audio Video Navigation,
